id;español;ingles
index_heading1;¿Quiénes somos?;About Us
index_p1;<b><span style='color: var(--voyager)'>Voyager</span></b> es un semillero de investigación con enfoques aeronáuticos y astronáuticos creado por un grupo de estudiantes de Ingeniería Aeroespacial de la Universidad de Antioquia en el año 2017, inicialmente, como un grupo de divulgación científica. Actualmente, dedicado al diseño y construcción de sistemas para vehículos aeroespaciales, tales como: sistemas de sensoramiento, comunicaciones, estructura, procesamiento de imágenes, entre otros.;<b><span style='color: var(--voyager)'>Voyager</span></b> is a research group with aeronautical and astronautical approaches created by a group of students of Aerospace Engineering at the University of Antioquia in 2017, initially, as a group of scientific dissemination. Currently, dedicated to the design and construction of systems for aerospace vehicles, such as: sensing systems, communications, structure, image processing, among others.
index_p2;Con experiencia y destacada participación en concursos nacionales, en los que se han obtenido los primeros puestos con el diseño y construcción de pequeños satélites, alas zagi, rovers y demás. El semillero, constantemente está en busca de nuevos retos en los que pongamos a prueba nuestras habilidades y capacidades de ingenio, creatividad y solución de problemas, donde podamos contribuir a la sociedad y construir un mejor mañana.;With experience and outstanding participation in national competitions, in which we have obtained the first places with the design and construction of small satellites, zagi wings, rovers and others. The research group, is constantly looking for new challenges in which we test our skills and abilities of ingenuity, creativity and problem solving, where we can contribute to society and build a better world.
index_heading2;Líneas de investigación;Research Areas
index_p3;Estas son nuestras líneas de investigación y respectivos proyectos activos del semillero.;These are our lines of research and respective active projects of the group.
index_heading3;¿Deseas pertenecer al semillero?;Willing to be part of Voyager?
index_p4;A día de hoy <b>no tenemos ninguna</b> convocatoria activa. Normalmente, estas se realizan a inicio de semestre por lo que debes estar atento a nuestras redes sociales.;<b>We do not have</b> any active call for applications right now. Normally, these are held at the beginning of the semester, so you should keep an eye on our social networks.
